{"event_id":"worker-callback-recorded-46828a416b1544230487d76c4421190f","event_type":"worker.callback.recorded","occurred_at":"2026-09-26T03:33:46Z","operation_generation":1,"operation_id":"op-3a6b6a776b24e9a277247782816a27f1b2c12694","payload":{"callback_digest":"4d63255da6d18b074389978828386c6605c9eb2de561a3c572273f3a7f2b0bb1","callback_id":"gh-aw-callback-a8281ba1403dbe6a48f8bf75","external_dispatch_key":"dispatch-d96d3cb82eaf214d347509b687fe8bd81b86fe3f","trusted_callback_envelope":{"collected_outputs":[{"candidate_head_sha":"43690c8f11bd4e106c5e3bcfb9701be1824f9e8a","collected_at":"2026-09-26T03:33:41Z","collector_identity":"ai-sdlc-v03-real-runtime-release-collector","dispatch_id":"vertical-9672960ea5d3d91e400e90cc66bd6ffc","expected_revision":1,"external_dispatch_key":"dispatch-d96d3cb82eaf214d347509b687fe8bd81b86fe3f","feature_id":"F-OPERATOR-V03-REAL-RUNTIME-FI-0017","kind":"evidence","label":"review-evidence","media_type":"application/json","operation_generation":1,"operation_id":"op-3a6b6a776b24e9a277247782816a27f1b2c12694","operation_profile":"vertical-implementation-review-qa/v1","output_id":"gh-aw-output-5f2d730b74180d96f070aa14","semantic_effect_key":"80c908650f728899b937206d4230adb4fda0de072ffc9e1d5aa78a09fdcf292d","sha256":"d9922ed4ee1f68c8487c0079852c3b2e54497d9dc0cbdb86e04c98c5437beb7e","size_bytes":735,"target_repository":"dream-xin/ai-sdlc","trusted_uri":"docs/features/F-OPERATOR-V03-REAL-RUNTIME-FI-0017/worker-runs/vertical-9672960ea5d3d91e400e90cc66bd6ffc/reviewer-comment-5842804556-binding-1023a0b5567ea0a5c0654173db102d9fa9020715d5512a6dceae409bcf418c9f--first-attempt--key-dispatch-d96d3cb82eaf214d347509b687fe8bd81b86fe3f--run-36214940184--head-eb1397331af5c4ffa912f9a5036701175c80ca79--lease-8ef343ee653b3f12d679415d07099b1019f1be00d55cb53febf1d0d62d99637b.json","worker_identity":"gh-aw:ai-sdlc-gh-aw-reviewer-copilot-v03-local.lock.yml@eb1397331af5c4ffa912f9a5036701175c80ca79","worker_role":"reviewer"}],"trusted_context":{"candidate_head_sha":"43690c8f11bd4e106c5e3bcfb9701be1824f9e8a","candidate_pr_number":421,"collector_identity":"ai-sdlc-v03-real-runtime-release-collector","dispatch_id":"vertical-9672960ea5d3d91e400e90cc66bd6ffc","expected_revision":1,"external_dispatch_key":"dispatch-d96d3cb82eaf214d347509b687fe8bd81b86fe3f","feature_id":"F-OPERATOR-V03-REAL-RUNTIME-FI-0017","feature_stage":"code-review","operation_generation":1,"operation_id":"op-3a6b6a776b24e9a277247782816a27f1b2c12694","operation_profile":"vertical-implementation-review-qa/v1","role":"reviewer","runtime_receipt_identity":"36214940184","semantic_effect_key":"80c908650f728899b937206d4230adb4fda0de072ffc9e1d5aa78a09fdcf292d","target_ref":"verification/v0.3-real-runtime-fixture-221-r17","target_repository":"dream-xin/ai-sdlc","task_id":"vertical:code-review:43690c8f11bd4e106c5e3bcfb9701be1824f9e8a","worker_identity":"gh-aw:ai-sdlc-gh-aw-reviewer-copilot-v03-local.lock.yml@eb1397331af5c4ffa912f9a5036701175c80ca79"},"worker_payload":{"findings":[],"outputs":[{"kind":"evidence","label":"review-evidence"}],"summary":"Trusted gh-aw reviewer verdict PASS.","verdict":"PASS"}},"trusted_callback_envelope_digest":"12315ab94dad9328388bd7b6e88e8dca4c7972092c7dec379608841769587858"},"schema_version":"ai-sdlc.operation-event/v1","sequence":11,"trusted_context_digest":"6628e3d86fb76eaac4ef415eab6f209b462e472366be9fad5f4e074824de5924"}
