{"event_id":"operation-cancelled-470fc64b2fd0ffbcd502a84375f50802","event_type":"operation.cancelled","occurred_at":"2026-10-02T15:07:36Z","operation_generation":0,"operation_id":"op-44cfc3ff9577493f5cfe2d9e8bdece3e0d42111d","payload":{"reason":"release fault injection: cancel before Persist linearization"},"schema_version":"ai-sdlc.operation-event/v1","sequence":10,"trusted_context_digest":"7f1d186057796e9fbebe53d073e0a19a05904a36fdc851c2bf677ecf4270affd"}
