{"event_id":"dispatch-launch-lookup-recorded-6a678a58578e6535c93efcb45585e1c6","event_type":"dispatch.launch.lookup-recorded","occurred_at":"2026-09-26T11:52:23Z","operation_generation":0,"operation_id":"op-bc9798ad5c7ec16f7778603f6dc78eb00410b763","payload":{"external_dispatch_key":"dispatch-2116a2c0106806f1c0efe24702408e3345a3b207","lookup_state":"LAUNCHED","receipt_id":"36240160554"},"schema_version":"ai-sdlc.operation-event/v1","sequence":6,"trusted_context_digest":"7b7c7dd02acb5f28d0f9078afbe9cb3432e45f34ff602813a9ed1375ba31c61e"}
