{"event_id":"persist-requested-e9445a37f6ecea8cb166ac5651f6c904","event_type":"persist.requested","occurred_at":"2026-10-02T11:02:16Z","operation_generation":0,"operation_id":"op-b606e60626ad209c5caeea9f7fcb6ff56eff3c7a","payload":{"candidate_head_sha":"6d99806b1bf918fa41f032a07b36b16333276f9d","expected_revision":1,"feature_event_id":"EVT-F-OPERATOR-V03-FI-DUPLICATE-WORKER-0001-VERTICAL-CODE-REVIEW-PASS-C5734EA26300","target_ref":"verification/v0.3-fi-duplicate-worker-221"},"schema_version":"ai-sdlc.operation-event/v1","sequence":9,"trusted_context_digest":"e3ae3ae29917ac80fb5d1bfff4f5dff590da0d01a56749b6ebd905c9072776a3"}
