{"event_id":"operation-started-d2424fbdb0ca4cc5e0eea5559924b979","event_type":"operation.started","occurred_at":"2026-10-02T10:02:01Z","operation_generation":0,"operation_id":"op-d877702fff9f7598d32d1e81943f44bdaa9f0143","payload":{"expected_revision":1,"feature_id":"F-OPERATOR-V03-FI-UNKNOWN-TAKEOVER-0007","operation_profile":"vertical-implementation-review-qa/v1","target_repository":"dream-xin/ai-sdlc"},"schema_version":"ai-sdlc.operation-event/v1","sequence":1,"trusted_context_digest":"trusted-runtime"}
