{"event_id":"persist-confirmed-f2b3ed03d6e076b2b18f7cae88672791","event_type":"persist.confirmed","occurred_at":"2026-09-26T10:44:50Z","operation_generation":1,"operation_id":"op-4eb6a09d35f991a36f2c8aac4eb6f1250495cf84","payload":{"candidate_head_sha":"1d851575e61d82c25ccf835cac86b843aea99b02","expected_revision":2,"feature_event_id":"EVT-F-OPERATOR-V03-REAL-RUNTIME-FI-0021-VERTICAL-VERIFICATION-START-25790C7D74DA","result_revision":3,"target_ref":"verification/v0.3-real-runtime-fixture-221-r21"},"schema_version":"ai-sdlc.operation-event/v1","sequence":21,"trusted_context_digest":"80074f870615285b1b88d8ae42f7131bbca089337edf904427abeecd70a55ed3"}
