{"event_id":"operation-superseded-71af600eac519d1dc75cc143a66f0039","event_type":"operation.superseded","occurred_at":"2026-09-25T08:44:44Z","operation_generation":0,"operation_id":"op-84fecb623993673f6c0ab21738ec036eca609b3d","payload":{"next_generation":1,"superseded_generation":0},"schema_version":"ai-sdlc.operation-event/v1","sequence":5,"trusted_context_digest":"50cff11dacda08ed44fbafd08083465197c6b57c438897f2edc08ab48c658acf"}
