{"event_id":"persist-linearized-2999d10a7f8fc24e0dc1f36c158abb76","event_type":"persist.linearized","occurred_at":"2026-09-26T14:57:16Z","operation_generation":1,"operation_id":"op-b98c48d8a34a2108ae4d83f8b10467d9311f0a27","payload":{"candidate_head_sha":"e3256bb2b6d140b465c36e8f13203af23ec35ef6","expected_revision":2,"feature_event_id":"EVT-F-OPERATOR-V03-REAL-RUNTIME-FI-0027-VERTICAL-VERIFICATION-START-25790C7D74DA","target_ref":"verification/v0.3-real-runtime-fixture-221-r27"},"schema_version":"ai-sdlc.operation-event/v1","sequence":20,"trusted_context_digest":"3d3e0050ed5c42edee2470e1bea2dfb5e35347e7cf1723041f98dd2d4ad25c77"}
