{"event_id":"dispatch-launch-lookup-recorded-0ce65e162660d9ba6c42e41b80da6999","event_type":"dispatch.launch.lookup-recorded","occurred_at":"2026-09-26T01:02:00Z","operation_generation":1,"operation_id":"op-05a34d649e3e163c54ccb0469ea55ef36e3a1ec2","payload":{"external_dispatch_key":"dispatch-737157f972c397bd78e749ce245b9becc3d051b0","lookup_state":"LAUNCHED","receipt_id":"36206946454"},"schema_version":"ai-sdlc.operation-event/v1","sequence":10,"trusted_context_digest":"c860ae3787be740e510716a0d536c987d7d035d1f6e1d4f8a0bd35ed5e00e114"}
