{"event_id":"persist-requested-897a60d9cafe29a03ba7ae0c84eedb0f","event_type":"persist.requested","occurred_at":"2026-10-02T12:18:18Z","operation_generation":0,"operation_id":"op-7aec3f3e6c6ca91890252b3aa0dfbf1d94ec1db9","payload":{"candidate_head_sha":"96a35f65749476e5dee2f06aefdf70c3a891f307","expected_revision":1,"feature_event_id":"EVT-F-OPERATOR-V03-FI-CANCEL-BEFORE-PERSIST-0003-VERTICAL-CODE-REVIEW-PASS-A2B326CAACF2","target_ref":"verification/v0.3-fi-cancel-before-persist-221-r3"},"schema_version":"ai-sdlc.operation-event/v1","sequence":9,"trusted_context_digest":"cf8beaa0979c36f88c229e635d733747493fe51e6bf7134869c4d55b2b66fd95"}
