{"event_id":"dispatch-launch-authorized-df9551273fd10e2e6d164d9de7937e42","event_type":"dispatch.launch.authorized","occurred_at":"2026-10-02T08:41:54Z","operation_generation":0,"operation_id":"op-152cf56ab312b25eebb80801734999a882e6fe4c","payload":{"candidate_head_sha":"e7652ae2450d3dd3ed2698fab3ce9fe6e8e134bf","claim_id":"dc-a2f0c0e7d472c1fd428b1c1d45d7e15b5c327226","dispatch_id":"vertical-86668d7a68df8822b6493553b0db920e","expected_revision":1,"external_dispatch_key":"dispatch-df325d52ef6ab099c082e18a5f5e123ce69d3b1c","feature_id":"F-OPERATOR-V03-REAL-RUNTIME-FI-0048","role":"reviewer","semantic_effect_key":"d3f266f47d0c4b1cf48d538e466d89729c4daa6c8028b48244fd94db6d3fd50f","stage":"code-review"},"schema_version":"ai-sdlc.operation-event/v1","sequence":4,"trusted_context_digest":"e4bb64e8d07e987f8543754d7e632786bad2c49c86cb31db064041a1e9e19ad5"}
