{"event_id":"dispatch-claimed-4d7a1ef180fcb37081a232d8be3ed361","event_type":"dispatch.claimed","occurred_at":"2026-10-02T08:41:54Z","operation_generation":0,"operation_id":"op-152cf56ab312b25eebb80801734999a882e6fe4c","payload":{"claim_id":"dc-a2f0c0e7d472c1fd428b1c1d45d7e15b5c327226","external_dispatch_key":"dispatch-df325d52ef6ab099c082e18a5f5e123ce69d3b1c","semantic_effect_key":"d3f266f47d0c4b1cf48d538e466d89729c4daa6c8028b48244fd94db6d3fd50f"},"schema_version":"ai-sdlc.operation-event/v1","sequence":3,"trusted_context_digest":"e4bb64e8d07e987f8543754d7e632786bad2c49c86cb31db064041a1e9e19ad5"}
