{"event_id":"loop-step-selected-c29e5cbbee1c2031217bd119abc0d899","event_type":"loop.step.selected","occurred_at":"2026-09-25T01:55:09Z","operation_generation":1,"operation_id":"op-a571465e14f372c9a275591ffdfd36d618bb33dc","payload":{"feature_revision":1,"kind":"dispatch","step":"CODE_REVIEW","task_identity":"vertical:code-review:758d015a096e4282734fff7ec6554a1a43bb76e2"},"schema_version":"ai-sdlc.operation-event/v1","sequence":7,"trusted_context_digest":"0b6ef22c16b529f8f361ca14862e310d784e8ec21b96f5a404e38134e26c768f"}
