{"event_id":"feature-event-translated-e831ae4dd95e98378f7e50a5ba38b58a","event_type":"feature.event.translated","occurred_at":"2026-09-27T08:08:55Z","operation_generation":1,"operation_id":"op-50a892e35bc4a66bfb88eaac4ca72c39846c578a","payload":{"callback_id":"gh-aw-callback-495fb664554f13f2afda0cfe","candidate_head_sha":"91d1f414a2e08ae69050a9deafcc369502c4a788","feature_event":{"changes":[{"kind":"evidence","record":{"id":"vertical-evidence-2ed1f7fb75cadf554f1a","status":"pass","type":"review","uri":"docs/features/F-OPERATOR-V03-REAL-RUNTIME-FI-0030/worker-runs/vertical-e711e0761aae536f15fbd41fdbdc4179/reviewer-comment-5854077916-binding-11cbdd64925420269a6b5aefb5daa19f12ac74f7d982ac93b35036016ce66315--first-attempt--key-dispatch-d62f52db3a0c92e1e74a9095a6ab3c0db070eec1--run-36305029550--head-f9d8007f13bef1ff78c5372563d915db825eab15--lease-11b225c47dcf4a15b1d9ba286d524f5c7ef84b1993c5534cf630afca4202ceb3.json"}},{"evidence":["vertical-evidence-2ed1f7fb75cadf554f1a"],"id":"implementation-v1","kind":"artifact","status":"approved"},{"evidence":["vertical-evidence-2ed1f7fb75cadf554f1a"],"id":"code-gate","kind":"gate","status":"PASS"},{"id":"code-review","kind":"stage","status":"DONE"},{"id":"verification","kind":"stage","status":"READY"}],"expected_revision":1,"feature_id":"F-OPERATOR-V03-REAL-RUNTIME-FI-0030","id":"EVT-F-OPERATOR-V03-REAL-RUNTIME-FI-0030-VERTICAL-CODE-REVIEW-PASS-50A797D3F205","occurred_at":"2026-09-27T08:08:39Z","version":"0.1.0"},"feature_event_digest":"33ff5f229c92124da95a884642a0980c7583aec2cf64f461f7a5e6c7ecbe6030","feature_event_id":"EVT-F-OPERATOR-V03-REAL-RUNTIME-FI-0030-VERTICAL-CODE-REVIEW-PASS-50A797D3F205","feature_manifest_digest":"17f37e79c59a6f74a2096f78419beca7aedc56a6773186141a15e8c776f6c81c","feature_revision":1,"feature_stage":"code-review","target_ref":"verification/v0.3-real-runtime-fixture-221-r30"},"schema_version":"ai-sdlc.operation-event/v1","sequence":13,"trusted_context_digest":"c4aec7dc3335ca77283eb664e471e0c187a9ca96a809cec7a15abe4fdeb6070a"}
