{"event_id":"dispatch-claimed-fa45596dd98258eb44aace842058d26d","event_type":"dispatch.claimed","occurred_at":"2026-09-25T15:40:05Z","operation_generation":1,"operation_id":"op-c5a5f28801839f7d8722f913b72b8122efa0f044","payload":{"claim_id":"dc-4d1f55cceb8e52d2209c1c3c47811ef686a084e1","external_dispatch_key":"dispatch-0b8d87c6f4ac4ba77978a01c396e8491ca615433","semantic_effect_key":"ae87056bc083b7dfd0d6c79a1bf1d9f194112afec92f4fe57267cfcd7d6ecee6"},"schema_version":"ai-sdlc.operation-event/v1","sequence":8,"trusted_context_digest":"4a12784a26b1a12feeadd583346b3e99752445cafe32d1d235794c3bc4bcd46a"}
