{"event_id":"operation-generation-started-43085e338abee4c79cb6f57cc86ebf23","event_type":"operation.generation.started","occurred_at":"2026-09-25T08:44:44Z","operation_generation":1,"operation_id":"op-84fecb623993673f6c0ab21738ec036eca609b3d","payload":{"previous_generation":0},"schema_version":"ai-sdlc.operation-event/v1","sequence":6,"trusted_context_digest":"50cff11dacda08ed44fbafd08083465197c6b57c438897f2edc08ab48c658acf"}
