{"event_id":"dispatch-claimed-e864be3c4e8f1f83d1386db592683d12","event_type":"dispatch.claimed","occurred_at":"2026-09-28T15:22:49Z","operation_generation":0,"operation_id":"op-16757c0383e7969e599ba267fe23e02487a7ddb9","payload":{"claim_id":"dc-4d02e652fd04a19267af7ce889687b06e9d5ef5f","external_dispatch_key":"dispatch-42e5f734780bb90fa97c5019d0ad9919645401b2","semantic_effect_key":"d9786b8ddd5d891b1406b6d0bbfa22680b2622962ca7d67e93c96ec1815b9c96"},"schema_version":"ai-sdlc.operation-event/v1","sequence":3,"trusted_context_digest":"3cf4e6651ec899ff90ddebc27b6b0c8014d61c64922662770623c60c3e0a8130"}
