{"event_id":"persist-linearized-080206861a05646ccb46705dc8dbfb73","event_type":"persist.linearized","occurred_at":"2026-10-02T15:18:51Z","operation_generation":0,"operation_id":"op-c95b421d77f7999baf82c926c41313402834d86c","payload":{"candidate_head_sha":"b8c8b20f425d0d73ebe718f6e785430b4accf71d","expected_revision":1,"feature_event_id":"EVT-F-OPERATOR-V03-FI-PERSIST-BEFORE-CANCEL-0003-VERTICAL-CODE-REVIEW-PASS-BD288EFC5129","target_ref":"verification/v0.3-fi-persist-before-cancel-221-r3"},"schema_version":"ai-sdlc.operation-event/v1","sequence":10,"trusted_context_digest":"36909c43e91ad83c51f0465ac3dfc9f0dbc24f710119ceeb85e561ff1bd37065"}
