{"event_id":"dispatch-launch-lookup-recorded-5365593d090ea52539e3274e4ec915dc","event_type":"dispatch.launch.lookup-recorded","occurred_at":"2026-09-27T11:15:27Z","operation_generation":0,"operation_id":"op-6d8b2c7ada6a7ef8f3f30d52ac7840fbb75361ec","payload":{"external_dispatch_key":"dispatch-47848d29d76458f8d74b668ba7cc93a7ff15ca88","lookup_state":"UNKNOWN","receipt_id":null},"schema_version":"ai-sdlc.operation-event/v1","sequence":5,"trusted_context_digest":"2332b5c09de44efef08fd80c260548ab45435c1a6c03d5f51726d01c7eb403e3"}
