{"event_id":"feature-event-translated-8b7c2c261aa033a21ca8686a18270680","event_type":"feature.event.translated","occurred_at":"2026-10-02T09:48:02Z","operation_generation":1,"operation_id":"op-e0b821c7a9dd2a887fe60a8ba7eb829b4982dd45","payload":{"callback_id":"gh-aw-callback-03010123be9ac3a4f9a997f8","candidate_head_sha":"b5c89222ebc2cc5d9b655868380c0731a759bc4a","feature_event":{"changes":[{"kind":"evidence","record":{"id":"vertical-evidence-8ecfe7e1a0fb72b87100","status":"pass","type":"review","uri":"docs/features/F-OPERATOR-V03-REAL-RUNTIME-FI-0049/worker-runs/vertical-7ecce585389600ca68b8b03ccd1e0c72/reviewer-comment-5949518774-binding-01e21e48d8aecc5ea36db9439e1f417b5c0c4667434fd73fe21d942311752df9--first-attempt--key-dispatch-13f19d9326a06a249b3d8be7dc74c7b004142970--run-36991373703--head-68cd7d65296223b797b667cb37e7b47494b2b760--lease-b81a97354477b838f9cebec858a3688779ce27ca7694e3fd2963ec7fe883c9bd.json"}},{"evidence":["vertical-evidence-8ecfe7e1a0fb72b87100"],"id":"implementation-v1","kind":"artifact","status":"approved"},{"evidence":["vertical-evidence-8ecfe7e1a0fb72b87100"],"id":"code-gate","kind":"gate","status":"PASS"},{"id":"code-review","kind":"stage","status":"DONE"},{"id":"verification","kind":"stage","status":"READY"}],"expected_revision":1,"feature_id":"F-OPERATOR-V03-REAL-RUNTIME-FI-0049","id":"EVT-F-OPERATOR-V03-REAL-RUNTIME-FI-0049-VERTICAL-CODE-REVIEW-PASS-90E5EE8C90F3","occurred_at":"2026-10-02T09:47:39Z","version":"0.1.0"},"feature_event_digest":"34ee0c34bcad8f496c62998c7189df842e315945a6f9f464cdd61040fddb7b12","feature_event_id":"EVT-F-OPERATOR-V03-REAL-RUNTIME-FI-0049-VERTICAL-CODE-REVIEW-PASS-90E5EE8C90F3","feature_manifest_digest":"bc186cbd10bb4692002e76c1aebf397e132e860e5fa92d482a265644fa37db46","feature_revision":1,"feature_stage":"code-review","target_ref":"verification/v0.3-real-runtime-fixture-221-r49"},"schema_version":"ai-sdlc.operation-event/v1","sequence":13,"trusted_context_digest":"2c53ac866f92751f4461807c672c19f0f29c76a866cbcdb3273d6633fb73a601"}
