{"event_id":"operation-generation-started-a4778559e16846f2c379eae538ca58f9","event_type":"operation.generation.started","occurred_at":"2026-10-02T07:21:25Z","operation_generation":1,"operation_id":"op-5d48298138da23ae8959accdbf9199b62a3183b0","payload":{"previous_generation":0},"schema_version":"ai-sdlc.operation-event/v1","sequence":6,"trusted_context_digest":"f0f0615cfa3510d55214b8e05baac43e072423bf9db49c161d2b00a4bb3d7861"}
