{"event_id":"operation-started-ff24e5a2df40b77e53e8198e294fd98e","event_type":"operation.started","occurred_at":"2026-09-27T10:18:37Z","operation_generation":0,"operation_id":"op-3c056b66af5875bae6f04119a10ecb7b9ed38cf7","payload":{"expected_revision":1,"feature_id":"F-OPERATOR-V03-FI-CONCURRENT-RESUME-0003","operation_profile":"vertical-implementation-review-qa/v1","target_repository":"dream-xin/ai-sdlc"},"schema_version":"ai-sdlc.operation-event/v1","sequence":1,"trusted_context_digest":"trusted-runtime"}
