{"event_id":"loop-step-selected-635ed43952cb2edd49798341cffa5cee","event_type":"loop.step.selected","occurred_at":"2026-10-02T07:19:28Z","operation_generation":0,"operation_id":"op-5d48298138da23ae8959accdbf9199b62a3183b0","payload":{"feature_revision":1,"kind":"dispatch","step":"CODE_REVIEW","task_identity":"vertical:code-review:42bb5e2c4e9701eac375695b5cb2b8e78c6f5c2d"},"schema_version":"ai-sdlc.operation-event/v1","sequence":2,"trusted_context_digest":"071c84b6582034115b1d6280809dec62da4b52ba1598f4d2b32b047e860d33b0"}
