{"event_id":"operation-started-efa52f2ea3ddc89ec0081fc29beb3199","event_type":"operation.started","occurred_at":"2026-10-02T11:35:18Z","operation_generation":0,"operation_id":"op-38dc472d5b81fab14f86ef8c33be7171415492e5","payload":{"expected_revision":3,"feature_id":"F-OPERATOR-V03-REAL-RUNTIME-FI-0050","operation_profile":"vertical-implementation-review-qa/v1","target_repository":"dream-xin/ai-sdlc"},"schema_version":"ai-sdlc.operation-event/v1","sequence":1,"trusted_context_digest":"trusted-runtime"}
